### ISSUE TITLE
[Bug]: Kubernetes deployment does not respect http*_proxy environment variables

### ISSUE THREAD

**Issue by Kortekaasy** [project-zot/zot#1916]
### zot version

v.1.4.3

### Describe the bug

For my deployment of Zot I'd like to use an S3 backend. Furthermore, I proxy all my outgoing traffic through an HTTP proxy. However, I have a hard time getting Zot to use the HTTP proxy. Looking at the sourcecode, it seems that the application should respect HTTP_PROXY environment vars, but I cannot get it to work on my side

### To reproduce

1. Configuration
Custom resources:
```yaml
apiVersion: v1
kind: Secret
metadata:
  name: zot-aws-secret
type: Opaque
data:
  AWS_ACCESS_KEY_ID: "VEVTVF9BQ0NFU1NfS0VZX0lE" # Base64 of "TEST_ACCESS_KEY_ID"
  AWS_SECRET_ACCESS_KEY: "VEVTVF9TRUNSRVRfQUNDRVNTX0tFWQ==" # Base64 of "TEST_SECRET_ACCESS_KEY"
---
apiVersion: v1
kind: Service
metadata:
  name: squid-service
  labels:
    app: squid
spec:
  ports:
  - port: 3128
  selector:
    app: squid
---
apiVersion: apps/v1
kind: Deployment
metadata:
  name: squid-deployment
spec:
  replicas: 1
  selector:
    matchLabels:
      app: squid
  template:
    metadata:
      labels:
        app: squid
    spec:
      containers:
      - name: squid
        image: ubuntu/squid:edge
        ports:
        - containerPort: 3128
          name: squid
          protocol: TCP
        volumeMounts:
        - name: squid-config-volume
          mountPath: /etc/squid/squid.conf
          subPath: squid.conf
      volumes:
        - name: squid-config-volume
          configMap:
            name: squid-config
            items:
            - key: squid
              path: squid.conf
---
apiVersion: v1
data:
  squid: "acl localnet src 0.0.0.1-0.255.255.255\t# RFC 1122 \"this\" network (LAN)\nacl
    localnet src 10.0.0.0/8\t\t# RFC 1918 local private network (LAN)\nacl localnet
    src 100.64.0.0/10\t\t# RFC 6598 shared address space (CGN)\nacl localnet src 169.254.0.0/16
    \t# RFC 3927 link-local (directly plugged) machines\nacl localnet src 172.16.0.0/12\t\t#
    RFC 1918 local private network (LAN)\nacl localnet src 192.168.0.0/16\t\t# RFC
    1918 local private network (LAN)\nacl localnet src fc00::/7       \t# RFC 4193
    local private network range\nacl localnet src fe80::/10      \t# RFC 4291 link-local
    (directly plugged) machines\nacl SSL_ports port 443\nacl Safe_ports port 80\t\t#
    http\nacl Safe_ports port 21\t\t# ftp\nacl Safe_ports port 443\t\t# https\nacl
    Safe_ports port 70\t\t# gopher\nacl Safe_ports port 210\t\t# wais\nacl Safe_ports
    port 1025-65535\t# unregistered ports\nacl Safe_ports port 280\t\t# http-mgmt\nacl
    Safe_ports port 488\t\t# gss-http\nacl Safe_ports port 591\t\t# filemaker\nacl
    Safe_ports port 777\t\t# multiling http\nacl CONNECT method CONNECT\nhttp_access
    deny !Safe_ports\nhttp_access deny CONNECT !SSL_ports\nhttp_access allow localhost
    manager\nhttp_access deny manager\nhttp_access allow localhost\nhttp_access allow
    localnet\nhttp_access deny all\nhttp_port 3128\ncoredump_dir /var/spool/squid\nrefresh_pattern
    ^ftp:\t\t1440\t20%\t10080\nrefresh_pattern ^gopher:\t1440\t0%\t1440\nrefresh_pattern
    -i (/cgi-bin/|\\?) 0\t0%\t0\nrefresh_pattern \\/(Packages|Sources)(|\\.bz2|\\.gz|\\.xz)$
    0 0% 0 refresh-ims\nrefresh_pattern \\/Release(|\\.gpg)$ 0 0% 0 refresh-ims\nrefresh_pattern
    \\/InRelease$ 0 0% 0 refresh-ims\nrefresh_pattern \\/(Translation-.*)(|\\.bz2|\\.gz|\\.xz)$
    0 0% 0 refresh-ims\nrefresh_pattern .\t\t0\t20%\t4320\nlogfile_rotate 0\n"
kind: ConfigMap
metadata:
  creationTimestamp: null
  name: squid-config
```
Helm values:
```yaml
replicaCount: 1
service:
  type: ClusterIP
mountConfig: true
configFiles: 
  config.json: |-
    {
        "distSpecVersion": "1.0.1-dev",
        "storage": {
            "rootDirectory": "/tmp/zot",
            "dedupe": false,
            "storageDriver": {
                "name": "s3",
                "rootdirectory": "/zot",
                "region": "eu-west-1",
                "bucket": "org.example.test-repo",
                "encrypt": true,
                "secure": true,
                "skipverify": true
            }
        },
        "http": {
            "address": "0.0.0.0",
            "port": "5000"
        },
        "log": {
            "level": "trace"
        }
    }
image:
  repository: ghcr.io/project-zot/zot-linux-amd64
  tag: "v1.4.3"
env:
- name: AWS_ACCESS_KEY_ID
  valueFrom:
    secretKeyRef:
      name: zot-aws-secret
      key: AWS_ACCESS_KEY_ID
- name: AWS_SECRET_ACCESS_KEY
  valueFrom:
    secretKeyRef:
      name: zot-aws-secret
      key: AWS_SECRET_ACCESS_KEY
- name: HTTP_PROXY
  value: "http://squid-service.default.svc.cluster.local:3128"
- name: http_proxy
  value: "http://squid-service.default.svc.cluster.local:3128"
- name: HTTPS_PROXY
  value: "http://squid-service.default.svc.cluster.local:3128"
- name: https_proxy
  value: "http://squid-service.default.svc.cluster.local:3128"
```
2. Apply resources and helm chart
3. Run
```
% kubectl run test-$RANDOM --rm -i -t --image=alpine -- ash
If you don't see a command prompt, try pressing enter.
/ # wget http://zot.default.svc.cluster.local:5000/v2/_catalog
Connecting to zot.default.svc.cluster.local:5000 (10.97.204.23:5000)
```
4. Check logs of Squid proxy
```
% kubectl get pods
NAME                                READY   STATUS             RESTARTS      AGE
squid-deployment-768656f657-zg588   1/1     Running            0             5m
zot-856cb7d78-5ppbm                 1/1     Running            0             4m
% kubectl logs squid-deployment-768656f657-zg588
```

### Expected behavior

The squid logs should show the zot registry perform a `CONNECT` request to `s3.eu-west-1.amazonaws.com`. Instead, the squid logs show no activity.

### Additional context

Performed on a fresh minikube instance. TCP dumps show zot resolving the `s3.eu-west-1.amazonaws.com`, and trying to connect to there directly:
```
07:34:55.764880 IP zot-856cb7d78-m4hdh.49895 > kube-dns.kube-system.svc.cluster.local.53: 1239+ [1au] AAAA? s3.eu-west-1.amazonaws.com.cluster.local. (69)
07:34:55.764909 IP zot-856cb7d78-m4hdh.45298 > kube-dns.kube-system.svc.cluster.local.53: 15235+ [1au] A? s3.eu-west-1.amazonaws.com.cluster.local. (69)
07:34:55.765333 IP zot-856cb7d78-m4hdh.60081 > kube-dns.kube-system.svc.cluster.local.53: 62357+ [1au] AAAA? s3.eu-west-1.amazonaws.com. (55)
07:34:55.765389 IP zot-856cb7d78-m4hdh.60709 > kube-dns.kube-system.svc.cluster.local.53: 29910+ [1au] A? s3.eu-west-1.amazonaws.com. (55)
07:34:55.862853 IP zot-856cb7d78-m4hdh.42940 > s3-eu-west-1.amazonaws.com.443: Flags [S], seq 949395523, win 64240, options [mss 1460,sackOK,TS val 1046646611 ecr 0,nop,wscale 7], length 0
07:34:55.867403 IP zot-856cb7d78-m4hdh.56505 > kube-dns.kube-system.svc.cluster.local.53: 18224+ PTR? 83.57.218.52.in-addr.arpa. (43)
```

**Comment by rchincha** [comment]
@Kortekaasy 

Your helm chart does have a `env:` section and this should have worked. We have a few bare-metal zot deployments that use a proxy but we have never tried with a helm chart though.

**Comment by Kortekaasy** [comment]
@rchincha Thanks for your reply. Updating to `v2.0.0-rc6` does not seem to help. Looking at minikube, the environment variables are present in the process environment:
```
% docker ps
CONTAINER ID   IMAGE                                 COMMAND                  CREATED          STATUS          PORTS                                                                                                                                  NAMES
fbf1800c3071   gcr.io/k8s-minikube/kicbase:v0.0.40   "/usr/local/bin/entr…"   50 minutes ago   Up 50 minutes   127.0.0.1:53831->22/tcp, 127.0.0.1:53832->2376/tcp, 127.0.0.1:53834->5000/tcp, 127.0.0.1:53835->8443/tcp, 127.0.0.1:53833->32443/tcp   minikube
% docker exec -it fbf1800c3071 bash
root@minikube:/# ps aux | grep zot
root        4077  2.0  1.6 853524 135816 ?       Ssl  06:23   0:57 /usr/local/bin/zot-linux-arm64 serve /etc/zot/config.json
root       37262  0.0  0.0   2884  1536 pts/1    S+   07:10   0:00 grep --color=auto zot
root@minikube:/# cat /proc/4077/environ | tr '\0' '\n'
PATH=/usr/local/sbin:/usr/local/bin:/usr/sbin:/usr/bin:/sbin:/bin
HOSTNAME=zot-7658d9bdd4-9tsmv
https_proxy=http://squid-service.default.svc.cluster.local:3128
AWS_ACCESS_KEY_ID=TEST_ACCESS_KEY_ID
AWS_SECRET_ACCESS_KEY=TEST_SECRET_ACCESS_KEY
HTTP_PROXY=http://squid-service.default.svc.cluster.local:3128
http_proxy=http://squid-service.default.svc.cluster.local:3128
HTTPS_PROXY=http://squid-service.default.svc.cluster.local:3128
SQUID_SERVICE_PORT=tcp://10.103.123.1:3128
SQUID_SERVICE_PORT_3128_TCP_PROTO=tcp
SQUID_SERVICE_PORT_3128_TCP_PORT=3128
ZOT_SERVICE_HOST=10.105.181.91
ZOT_PORT_5000_TCP=tcp://10.105.181.91:5000
KUBERNETES_PORT_443_TCP=tcp://10.96.0.1:443
SQUID_SERVICE_SERVICE_PORT=3128
SQUID_SERVICE_PORT_3128_TCP=tcp://10.103.123.1:3128
SQUID_SERVICE_PORT_3128_TCP_ADDR=10.103.123.1
ZOT_SERVICE_PORT_ZOT=5000
ZOT_PORT=tcp://10.105.181.91:5000
KUBERNETES_SERVICE_HOST=10.96.0.1
KUBERNETES_SERVICE_PORT=443
ZOT_PORT_5000_TCP_PROTO=tcp
ZOT_PORT_5000_TCP_PORT=5000
ZOT_PORT_5000_TCP_ADDR=10.105.181.91
KUBERNETES_PORT=tcp://10.96.0.1:443
KUBERNETES_PORT_443_TCP_PORT=443
SQUID_SERVICE_SERVICE_HOST=10.103.123.1
ZOT_SERVICE_PORT=5000
KUBERNETES_SERVICE_PORT_HTTPS=443
KUBERNETES_PORT_443_TCP_PROTO=tcp
KUBERNETES_PORT_443_TCP_ADDR=10.96.0.1
SSL_CERT_FILE=/etc/ssl/certs/ca-certificates.crt
HOME=/root
```

**Comment by rchincha** [comment]
@Kortekaasy a question (albeit naive one perhaps),

% kubectl logs squid-deployment-768656f657-zg588

http://www.squid-cache.org/Doc/config/access_log/

Default:
		access_log daemon:/usr/local/squid/var/logs/access.log squid
		
^ don't see a log config in your squid.conf, so does this send logs to stdout for "kubectl logs" to pick up?

**Comment by Kortekaasy** [comment]
@rchincha When I manually send a request to the squid service, it does show logs:
```
% kubectl run test-$RANDOM --rm -i -t --image=alpine -- sh
If you don't see a command prompt, try pressing enter.
/ # wget http://squid-service.default.svc.cluster.local:3128/test-for-github-issue
Connecting to squid-service.default.svc.cluster.local:3128 (10.103.234.84:3128)
wget: server returned error: HTTP/1.1 400 Bad Request
```
```
% kubectl logs squid-deployment-768656f657-vtkt6
... snip unneeded logs ...
1697046788.942      0 10.0.3.160 NONE_NONE/400 4030 GET /test-for-github-issue - HIER_NONE/- text/html
```

Furthermore, the tcp dump from my first message also shows zot doesn't even try resolving the HTTP_PROXY address, it just straight resolves the s3 URL.

**Comment by rchincha** [comment]
@Kortekaasy got it.

In theory, the following should have worked.
https://aws.github.io/aws-sdk-go-v2/docs/configuring-sdk/custom-http/#configuring-a-proxy

**Comment by Andreea-Lupu** [comment]
Hi @Kortekaasy. @peusebiu and I investigated your issue. The problem is caused by the value of "skipverify" field from the zot config that you use. This causes http_proxy env to be ignored. It seems to be a bug from the aws-s3 docker storage library that we use https://github.com/distribution/distribution/tree/main/registry/storage/driver and we will open an issue for it.
For the moment, try to set the value of this field to false, this should solve your issue.

**Comment by Kortekaasy** [comment]
Hi @Andreea-Lupu, @peusebiu,

Thanks for the investigations. Settings `skipverify` to false indeed resolves the issue. Can you link the issue you've opened in the aws-s3 docker storage library?

**Comment by Andreea-Lupu** [comment]
https://github.com/distribution/distribution/issues/4112
